cve_id,vendor,product,vuln_name,dateAdded,dueDate,notes
CVE-2020-9377,D-Link,DIR-610 Devices,D-Link DIR-610 Devices Remote Command Execution,2022-03-25,2022-04-15,https://nvd.nist.gov/vuln/detail/CVE-2020-9377
CVE-2020-9054,Zyxel,Multiple Network-Attached Storage (NAS) Devices,Zyxel Multiple NAS Devices OS Command Injection Vulnerability,2022-03-25,2022-04-15,https://nvd.nist.gov/vuln/detail/CVE-2020-9054
CVE-2020-7247,OpenBSD,OpenSMTPD,OpenSMTPD Remote Code Execution Vulnerability,2022-03-25,2022-04-15,https://nvd.nist.gov/vuln/detail/CVE-2020-7247
CVE-2020-5410,VMware Tanzu,Spring Cloud Configuration (Config) Server,VMware Tanzu Spring Cloud Config Directory Traversal Vulnerability,2022-03-25,2022-04-15,https://nvd.nist.gov/vuln/detail/CVE-2020-5410
CVE-2020-25223,Sophos,SG UTM,Sophos SG UTM Remote Code Execution Vulnerability,2022-03-25,2022-04-15,https://nvd.nist.gov/vuln/detail/CVE-2020-25223
CVE-2020-2506,QNAP Systems,Helpdesk,QNAP Helpdesk Improper Access Control Vulnerability,2022-03-25,2022-04-15,https://nvd.nist.gov/vuln/detail/CVE-2020-2506
CVE-2020-2021,Palo Alto Networks,PAN-OS,Palo Alto Networks PAN-OS Authentication Bypass Vulnerability,2022-03-25,2022-04-15,https://nvd.nist.gov/vuln/detail/CVE-2020-2021
CVE-2020-1956,Apache,Kylin,Apache Kylin OS Command Injection Vulnerability,2022-03-25,2022-04-15,https://nvd.nist.gov/vuln/detail/CVE-2020-1956
CVE-2020-1631,Juniper,Junos OS,Juniper Junos OS Path Traversal Vulnerability,2022-03-25,2022-04-15,https://nvd.nist.gov/vuln/detail/CVE-2020-1631
CVE-2019-6340,Drupal,Core,Drupal Core Remote Code Execution Vulnerability,2022-03-25,2022-04-15,https://nvd.nist.gov/vuln/detail/CVE-2019-6340
CVE-2019-2616,Oracle,BI Publisher (Formerly XML Publisher),Oracle BI Publisher Unauthorized Access Vulnerability,2022-03-25,2022-04-15,https://nvd.nist.gov/vuln/detail/CVE-2019-2616
CVE-2019-16920,D-Link,Multiple Routers,D-Link Multiple Routers Command Injection Vulnerability,2022-03-25,2022-04-15,https://nvd.nist.gov/vuln/detail/CVE-2019-16920
CVE-2019-15107,Webmin,Webmin,Webmin Command Injection Vulnerability,2022-03-25,2022-04-15,https://nvd.nist.gov/vuln/detail/CVE-2019-15107
CVE-2019-12991,Citrix,SD-WAN and NetScaler,Citrix SD-WAN and NetScaler Command Injection Vulnerability,2022-03-25,2022-04-15,https://nvd.nist.gov/vuln/detail/CVE-2019-12991
CVE-2019-12989,Citrix,SD-WAN and NetScaler,Citrix SD-WAN and NetScaler SQL Injection Vulnerability,2022-03-25,2022-04-15,https://nvd.nist.gov/vuln/detail/CVE-2019-12989
CVE-2019-11043,PHP,FastCGI Process Manager (FPM),PHP FastCGI Process Manager (FPM) Buffer Overflow Vulnerability,2022-03-25,2022-04-15,https://nvd.nist.gov/vuln/detail/CVE-2019-11043
CVE-2019-10068,Kentico,Xperience,Kentico Xperience Deserialization of Untrusted Data Vulnerability,2022-03-25,2022-04-15,https://nvd.nist.gov/vuln/detail/CVE-2019-10068
CVE-2019-1003030,Jenkins,Matrix Project Plugin,Jenkins Matrix Project Plugin Remote Code Execution Vulnerability,2022-03-25,2022-04-15,https://nvd.nist.gov/vuln/detail/CVE-2019-1003030
CVE-2019-0903,Microsoft,Graphics Device Interface (GDI),Microsoft GDI Remote Code Execution Vulnerability,2022-03-25,2022-04-15,https://nvd.nist.gov/vuln/detail/CVE-2019-0903
CVE-2018-8414,Microsoft,Windows,Microsoft Windows Shell Remote Code Execution Vulnerability,2022-03-25,2022-04-15,https://nvd.nist.gov/vuln/detail/CVE-2018-8414
CVE-2018-8373,Microsoft,Internet Explorer Scripting Engine,Microsoft Scripting Engine Memory Corruption Vulnerability,2022-03-25,2022-04-15,https://nvd.nist.gov/vuln/detail/CVE-2018-8373
CVE-2018-6961,VMware,SD-WAN Edge,VMware SD-WAN Edge by VeloCloud Command Injection Vulnerability,2022-03-25,2022-04-15,https://nvd.nist.gov/vuln/detail/CVE-2018-6961
CVE-2018-14839,LG,N1A1 NAS,LG N1A1 NAS Remote Command Execution Vulnerability,2022-03-25,2022-04-15,https://nvd.nist.gov/vuln/detail/CVE-2018-14839
CVE-2018-1273,VMware Tanzu,Spring Data Commons,VMware Tanzu Spring Data Commons Property Binder Vulnerability,2022-03-25,2022-04-15,https://nvd.nist.gov/vuln/detail/CVE-2018-1273
CVE-2018-11138,Quest,KACE System Management Appliance,Quest KACE System Management Appliance Remote Command Execution Vulnerability,2022-03-25,2022-04-15,https://nvd.nist.gov/vuln/detail/CVE-2018-11138
CVE-2018-0147,Cisco,Secure Access Control System (ACS),Cisco Secure Access Control System Java Deserialization Vulnerability,2022-03-25,2022-04-15,https://nvd.nist.gov/vuln/detail/CVE-2018-0147
CVE-2018-0125,Cisco,VPN Routers,Cisco VPN Routers Remote Code Execution Vulnerability,2022-03-25,2022-04-15,https://nvd.nist.gov/vuln/detail/CVE-2018-0125
CVE-2017-6334,NETGEAR,DGN2200 Devices,NETGEAR DGN2200 Devices OS Command Injection Vulnerability,2022-03-25,2022-04-15,https://nvd.nist.gov/vuln/detail/CVE-2017-6334
CVE-2017-6316,Citrix,"NetScaler SD-WAN Enterprise, CloudBridge Virtual WAN, and XenMobile Server",Citrix Multiple Products Remote Code Execution Vulnerability,2022-03-25,2022-04-15,https://nvd.nist.gov/vuln/detail/CVE-2017-6316
CVE-2017-3881,Cisco,IOS and IOS XE,Cisco IOS and IOS XE Remote Code Execution Vulnerability,2022-03-25,2022-04-15,https://nvd.nist.gov/vuln/detail/CVE-2017-3881
CVE-2017-12617,Apache,Tomcat,Apache Tomcat Remote Code Execution Vulnerability,2022-03-25,2022-04-15,https://nvd.nist.gov/vuln/detail/CVE-2017-12617
CVE-2017-12615,Apache,Tomcat,Apache Tomcat on Windows Remote Code Execution Vulnerability,2022-03-25,2022-04-15,https://nvd.nist.gov/vuln/detail/CVE-2017-12615
CVE-2017-0146,Microsoft,Windows,Microsoft Windows SMB Remote Code Execution Vulnerability,2022-03-25,2022-04-15,https://nvd.nist.gov/vuln/detail/CVE-2017-0146
CVE-2016-7892,Adobe,Flash Player,Adobe Flash Player Use-After-Free Vulnerability,2022-03-25,2022-04-15,https://nvd.nist.gov/vuln/detail/CVE-2016-7892
CVE-2016-4171,Adobe,Flash Player,Adobe Flash Player Remote Code Execution Vulnerability,2022-03-25,2022-04-15,https://nvd.nist.gov/vuln/detail/CVE-2016-4171
CVE-2016-1555,NETGEAR,Wireless Access Point (WAP) Devices,NETGEAR Multiple WAP Devices Command Injection Vulnerability,2022-03-25,2022-04-15,https://nvd.nist.gov/vuln/detail/CVE-2016-1555
CVE-2016-11021,D-Link,DCS-930L Devices,D-Link DCS-930L Devices OS Command Injection Vulnerability,2022-03-25,2022-04-15,https://nvd.nist.gov/vuln/detail/CVE-2016-11021
CVE-2016-10174,NETGEAR,WNR2000v5 Router,NETGEAR WNR2000v5 Router Buffer Overflow Vulnerability,2022-03-25,2022-04-15,https://nvd.nist.gov/vuln/detail/CVE-2016-10174
CVE-2016-0752,Rails,Ruby on Rails,Ruby on Rails Directory Traversal Vulnerability,2022-03-25,2022-04-15,https://nvd.nist.gov/vuln/detail/CVE-2016-0752
CVE-2015-4068,Arcserve,Unified Data Protection (UDP),Arcserve Unified Data Protection (UDP) Directory Traversal Vulnerability,2022-03-25,2022-04-15,https://nvd.nist.gov/vuln/detail/CVE-2015-4068
CVE-2015-3035,TP-Link,Multiple Archer Devices,TP-Link Multiple Archer Devices Directory Traversal Vulnerability,2022-03-25,2022-04-15,https://nvd.nist.gov/vuln/detail/CVE-2015-3035
CVE-2015-1427,Elastic,Elasticsearch,Elasticsearch Groovy Scripting Engine Remote Code Execution Vulnerability,2022-03-25,2022-04-15,https://nvd.nist.gov/vuln/detail/CVE-2015-1427
CVE-2015-1187,D-Link and TRENDnet,Multiple Devices,D-Link and TRENDnet Multiple Devices Remote Code Execution Vulnerability,2022-03-25,2022-04-15,https://nvd.nist.gov/vuln/detail/CVE-2015-1187
CVE-2015-0666,Cisco,Prime Data Center Network Manager (DCNM),Cisco Prime Data Center Network Manager (DCNM) Directory Traversal Vulnerability,2022-03-25,2022-04-15,https://nvd.nist.gov/vuln/detail/CVE-2015-0666
CVE-2014-6332,Microsoft,Windows,Microsoft Windows Object Linking & Embedding (OLE) Automation Array Remote Code Execution Vulnerability,2022-03-25,2022-04-15,https://nvd.nist.gov/vuln/detail/CVE-2014-6332
CVE-2014-6324,Microsoft,Kerberos Key Distribution Center (KDC),Microsoft Kerberos Key Distribution Center (KDC) Privilege Escalation Vulnerability,2022-03-25,2022-04-15,https://nvd.nist.gov/vuln/detail/CVE-2014-6324
CVE-2014-6287,Rejetto,HTTP File Server (HFS),Rejetto HTTP File Server (HFS) Remote Code Execution Vulnerability,2022-03-25,2022-04-15,https://nvd.nist.gov/vuln/detail/CVE-2014-6287
CVE-2014-3120,Elastic,Elasticsearch,Elasticsearch Remote Code Execution Vulnerability,2022-03-25,2022-04-15,https://nvd.nist.gov/vuln/detail/CVE-2014-3120
CVE-2014-0130,Rails,Ruby on Rails,Ruby on Rails Directory Traversal Vulnerability,2022-03-25,2022-04-15,https://nvd.nist.gov/vuln/detail/CVE-2014-0130
CVE-2013-5223,D-Link,DSL-2760U,D-Link DSL-2760U Gateway Cross-Site Scripting Vulnerability,2022-03-25,2022-04-15,https://nvd.nist.gov/vuln/detail/CVE-2013-5223
CVE-2013-4810,Hewlett Packard (HP),"ProCurve Manager (PCM), PCM+, Identity Driven Manager (IDM), and Application Lifecycle Management",HP Multiple Products Remote Code Execution Vulnerability,2022-03-25,2022-04-15,https://nvd.nist.gov/vuln/detail/CVE-2013-4810
CVE-2013-2251,Apache,Struts,Apache Struts Improper Input Validation Vulnerability,2022-03-25,2022-04-15,https://nvd.nist.gov/vuln/detail/CVE-2013-2251
CVE-2012-1823,PHP,PHP,PHP-CGI Query String Parameter Vulnerability,2022-03-25,2022-04-15,https://nvd.nist.gov/vuln/detail/CVE-2012-1823
CVE-2010-4345,Exim,Exim,Exim Privilege Escalation Vulnerability,2022-03-25,2022-04-15,https://nvd.nist.gov/vuln/detail/CVE-2010-4345
CVE-2010-4344,Exim,Exim,Exim Heap-Based Buffer Overflow Vulnerability,2022-03-25,2022-04-15,https://nvd.nist.gov/vuln/detail/CVE-2010-4344
CVE-2010-3035,Cisco,IOS XR,Cisco IOS XR Border Gateway Protocol (BGP) Denial-of-Service Vulnerability,2022-03-25,2022-04-15,https://nvd.nist.gov/vuln/detail/CVE-2010-3035
CVE-2010-2861,Adobe,ColdFusion,Adobe ColdFusion Directory Traversal Vulnerability,2022-03-25,2022-04-15,https://nvd.nist.gov/vuln/detail/CVE-2010-2861
CVE-2009-2055,Cisco,IOS XR,Cisco IOS XR Border Gateway Protocol (BGP) Denial-of-Service Vulnerability,2022-03-25,2022-04-15,https://nvd.nist.gov/vuln/detail/CVE-2009-2055
CVE-2009-1151,phpMyAdmin,phpMyAdmin,phpMyAdmin Remote Code Execution Vulnerability,2022-03-25,2022-04-15,https://nvd.nist.gov/vuln/detail/CVE-2009-1151
CVE-2009-0927,Adobe,Reader and Acrobat,Adobe Reader and Adobe Acrobat Stack-Based Buffer Overflow Vulnerability,2022-03-25,2022-04-15,https://nvd.nist.gov/vuln/detail/CVE-2009-0927
CVE-2005-2773,Hewlett Packard (HP),OpenView Network Node Manager,HP OpenView Network Node Manager Remote Code Execution Vulnerability,2022-03-25,2022-04-15,https://nvd.nist.gov/vuln/detail/CVE-2005-2773
CVE-2020-5135,SonicWall,SonicOS,SonicWall SonicOS Buffer Overflow Vulnerability,2022-03-15,2022-04-05,https://nvd.nist.gov/vuln/detail/CVE-2020-5135
CVE-2019-1405,Microsoft,Windows,Microsoft Windows Universal Plug and Play (UPnP) Service Privilege Escalation Vulnerability,2022-03-15,2022-04-05,https://nvd.nist.gov/vuln/detail/CVE-2019-1405
CVE-2019-1322,Microsoft,Windows,Microsoft Windows Privilege Escalation Vulnerability,2022-03-15,2022-04-05,https://nvd.nist.gov/vuln/detail/CVE-2019-1322
CVE-2019-1315,Microsoft,Windows,Microsoft Windows Error Reporting Manager Privilege Escalation Vulnerability,2022-03-15,2022-04-05,https://nvd.nist.gov/vuln/detail/CVE-2019-1315
CVE-2019-1253,Microsoft,Windows,Microsoft Windows AppX Deployment Server Privilege Escalation Vulnerability,2022-03-15,2022-04-05,https://nvd.nist.gov/vuln/detail/CVE-2019-1253
CVE-2019-1132,Microsoft,Win32k,Microsoft Win32k Privilege Escalation Vulnerability,2022-03-15,2022-04-05,https://nvd.nist.gov/vuln/detail/CVE-2019-1132
CVE-2019-1129,Microsoft,Windows,Microsoft Windows AppX Deployment Service (AppXSVC) Privilege Escalation Vulnerability,2022-03-15,2022-04-05,https://nvd.nist.gov/vuln/detail/CVE-2019-1129
CVE-2019-1069,Microsoft,Task Scheduler,Microsoft Task Scheduler Privilege Escalation Vulnerability,2022-03-15,2022-04-05,https://nvd.nist.gov/vuln/detail/CVE-2019-1069
CVE-2019-1064,Microsoft,Windows,Microsoft Windows AppX Deployment Service (AppXSVC) Privilege Escalation Vulnerability,2022-03-15,2022-04-05,https://nvd.nist.gov/vuln/detail/CVE-2019-1064
CVE-2019-0841,Microsoft,Windows,Microsoft Windows AppX Deployment Service (AppXSVC) Privilege Escalation Vulnerability,2022-03-15,2022-04-05,https://nvd.nist.gov/vuln/detail/CVE-2019-0841
CVE-2019-0543,Microsoft,Windows,Microsoft Windows Privilege Escalation Vulnerability,2022-03-15,2022-04-05,https://nvd.nist.gov/vuln/detail/CVE-2019-0543
CVE-2018-8120,Microsoft,Win32k,Microsoft Win32k Privilege Escalation Vulnerability,2022-03-15,2022-04-05,https://nvd.nist.gov/vuln/detail/CVE-2018-8120
CVE-2017-0101,Microsoft,Windows,Microsoft Windows Transaction Manager Privilege Escalation Vulnerability,2022-03-15,2022-04-05,https://nvd.nist.gov/vuln/detail/CVE-2017-0101
CVE-2016-3309,Microsoft,Windows,Microsoft Windows Kernel Privilege Escalation Vulnerability,2022-03-15,2022-04-05,https://nvd.nist.gov/vuln/detail/CVE-2016-3309
CVE-2015-2546,Microsoft,Win32k,Microsoft Win32k Memory Corruption Vulnerability,2022-03-15,2022-04-05,https://nvd.nist.gov/vuln/detail/CVE-2015-2546
CVE-2022-26486,Mozilla,Firefox,Mozilla Firefox Use-After-Free Vulnerability,2022-03-07,2022-03-21,https://nvd.nist.gov/vuln/detail/CVE-2022-26486
CVE-2022-26485,Mozilla,Firefox,Mozilla Firefox Use-After-Free Vulnerability,2022-03-07,2022-03-21,https://nvd.nist.gov/vuln/detail/CVE-2022-26485
CVE-2021-21973,VMware,vCenter Server and Cloud Foundation,VMware vCenter Server and Cloud Foundation Server Side Request Forgery (SSRF) Vulnerability,2022-03-07,2022-03-21,https://nvd.nist.gov/vuln/detail/CVE-2021-21973
CVE-2020-8218,Pulse Secure,Pulse Connect Secure,Pulse Connect Secure Code Injection Vulnerability,2022-03-07,2022-09-07,https://nvd.nist.gov/vuln/detail/CVE-2020-8218
CVE-2019-11581,Atlassian,Jira Server and Data Center,Atlassian Jira Server and Data Center Server-Side Template Injection Vulnerability,2022-03-07,2022-09-07,https://nvd.nist.gov/vuln/detail/CVE-2019-11581
CVE-2017-6077,NETGEAR,Wireless Router DGN2200,NETGEAR DGN2200 Remote Code Execution Vulnerability,2022-03-07,2022-09-07,https://nvd.nist.gov/vuln/detail/CVE-2017-6077
CVE-2016-6277,NETGEAR,Multiple Routers,NETGEAR Multiple Routers Remote Code Execution Vulnerability,2022-03-07,2022-09-07,https://nvd.nist.gov/vuln/detail/CVE-2016-6277
CVE-2013-0631,Adobe,ColdFusion,Adobe ColdFusion Information Disclosure Vulnerability,2022-03-07,2022-09-07,https://nvd.nist.gov/vuln/detail/CVE-2013-0631
CVE-2013-0629,Adobe,ColdFusion,Adobe ColdFusion Directory Traversal Vulnerability,2022-03-07,2022-09-07,https://nvd.nist.gov/vuln/detail/CVE-2013-0629
CVE-2013-0625,Adobe,ColdFusion,Adobe ColdFusion Authentication Bypass Vulnerability,2022-03-07,2022-09-07,https://nvd.nist.gov/vuln/detail/CVE-2013-0625
CVE-2009-3960,Adobe,BlazeDS,Adobe BlazeDS Information Disclosure Vulnerability,2022-03-07,2022-09-07,https://nvd.nist.gov/vuln/detail/CVE-2009-3960
CVE-2022-20708,Cisco,"Small Business RV160, RV260, RV340, and RV345 Series Routers",Cisco Small Business RV Series Routers Stack-based Buffer Overflow Vulnerability,2022-03-03,2022-03-17,https://nvd.nist.gov/vuln/detail/CVE-2022-20708
CVE-2022-20703,Cisco,"Small Business RV160, RV260, RV340, and RV345 Series Routers",Cisco Small Business RV Series Routers Stack-based Buffer Overflow Vulnerability,2022-03-03,2022-03-17,https://nvd.nist.gov/vuln/detail/CVE-2022-20703
CVE-2022-20701,Cisco,"Small Business RV160, RV260, RV340, and RV345 Series Routers",Cisco Small Business RV Series Routers Stack-based Buffer Overflow Vulnerability,2022-03-03,2022-03-17,https://nvd.nist.gov/vuln/detail/CVE-2022-20701
CVE-2022-20700,Cisco,"Small Business RV160, RV260, RV340, and RV345 Series Routers",Cisco Small Business RV Series Routers Stack-based Buffer Overflow Vulnerability,2022-03-03,2022-03-17,https://nvd.nist.gov/vuln/detail/CVE-2022-20700
CVE-2022-20699,Cisco,"Small Business RV160, RV260, RV340, and RV345 Series Routers",Cisco Small Business RV Series Routers Stack-based Buffer Overflow Vulnerability,2022-03-03,2022-03-17,https://nvd.nist.gov/vuln/detail/CVE-2022-20699
CVE-2021-41379,Microsoft,Windows,Microsoft Windows Installer Privilege Escalation Vulnerability,2022-03-03,2022-03-17,https://nvd.nist.gov/vuln/detail/CVE-2021-41379
CVE-2020-1938,Apache,Tomcat,Apache Tomcat Improper Privilege Management Vulnerability,2022-03-03,2022-03-17,https://nvd.nist.gov/vuln/detail/CVE-2020-1938
CVE-2020-11899,Treck TCP/IP stack,IPv6,Treck TCP/IP stack Out-of-Bounds Read Vulnerability,2022-03-03,2022-03-17,https://nvd.nist.gov/vuln/detail/CVE-2020-11899
CVE-2019-16928,Exim,Exim Internet Mailer,Exim Out-of-bounds Write Vulnerability,2022-03-03,2022-03-17,https://nvd.nist.gov/vuln/detail/CVE-2019-16928
CVE-2019-1652,Cisco,Small Business RV320 and RV325 Dual Gigabit WAN VPN Routers,Cisco Small Business Routers Improper Input Validation Vulnerability,2022-03-03,2022-03-17,https://nvd.nist.gov/vuln/detail/CVE-2019-1652
CVE-2019-1297,Microsoft,Excel,Microsoft Excel Remote Code Execution Vulnerability,2022-03-03,2022-03-17,https://nvd.nist.gov/vuln/detail/CVE-2019-1297
CVE-2018-8581,Microsoft,Exchange Server,Microsoft Exchange Server Privilege Escalation Vulnerability,2022-03-03,2022-03-17,https://nvd.nist.gov/vuln/detail/CVE-2018-8581
CVE-2018-8298,ChakraCore,ChakraCore scripting engine,ChakraCore Scripting Engine Type Confusion Vulnerability,2022-03-03,2022-03-17,https://nvd.nist.gov/vuln/detail/CVE-2018-8298
CVE-2018-0180,Cisco,IOS Software,Cisco IOS Software Denial-of-Service Vulnerability,2022-03-03,2022-03-17,https://nvd.nist.gov/vuln/detail/CVE-2018-0180
CVE-2018-0179,Cisco,IOS Software,Cisco IOS Software Denial-of-Service Vulnerability,2022-03-03,2022-03-17,https://nvd.nist.gov/vuln/detail/CVE-2018-0179
CVE-2018-0175,Cisco,"IOS, XR, and XE Software","Cisco IOS, XR, and XE Software Buffer Overflow Vulnerability",2022-03-03,2022-03-17,https://nvd.nist.gov/vuln/detail/CVE-2018-0175
CVE-2018-0174,Cisco,IOS XE Software,Cisco IOS Software and Cisco IOS XE Software Improper Input Validation Vulnerability,2022-03-03,2022-03-17,https://nvd.nist.gov/vuln/detail/CVE-2018-0174
CVE-2018-0173,Cisco,IOS and IOS XE Software,Cisco IOS and IOS XE Software Improper Input Validation Vulnerability,2022-03-03,2022-03-17,https://nvd.nist.gov/vuln/detail/CVE-2018-0173
CVE-2018-0172,Cisco,IOS and IOS XE Software,Cisco IOS and IOS XE Software Improper Input Validation Vulnerability,2022-03-03,2022-03-17,https://nvd.nist.gov/vuln/detail/CVE-2018-0172
CVE-2018-0167,Cisco,"IOS, XR, and XE Software","Cisco IOS, XR, and XE Software Buffer Overflow Vulnerability",2022-03-03,2022-03-17,https://nvd.nist.gov/vuln/detail/CVE-2018-0167
CVE-2018-0161,Cisco,IOS Software,Cisco IOS Software Resource Management Errors Vulnerability,2022-03-03,2022-03-17,https://nvd.nist.gov/vuln/detail/CVE-2018-0161
CVE-2018-0159,Cisco,IOS Software and Cisco IOS XE Software,Cisco IOS and XE Software Internet Key Exchange Version 1 Denial-of-Service Vulnerability,2022-03-03,2022-03-17,https://nvd.nist.gov/vuln/detail/CVE-2018-0159
CVE-2018-0158,Cisco,IOS Software and Cisco IOS XE Software,Cisco IOS and XE Software Internet Key Exchange Memory Leak Vulnerability,2022-03-03,2022-03-17,https://nvd.nist.gov/vuln/detail/CVE-2018-0158
CVE-2018-0156,Cisco,IOS Software and Cisco IOS XE Software,Cisco IOS Software and Cisco IOS XE Software Smart Install Denial-of-Service Vulnerability,2022-03-03,2022-03-17,https://nvd.nist.gov/vuln/detail/CVE-2018-0156
CVE-2018-0155,Cisco,Catalyst 4500 Series Switches and Cisco Catalyst 4500-X Series Switches,Cisco Catalyst Bidirectional Forwarding Detection Denial-of-Service Vulnerability,2022-03-03,2022-03-17,https://nvd.nist.gov/vuln/detail/CVE-2018-0155
CVE-2018-0154,Cisco,IOS Software,Cisco IOS Software Integrated Services Module for VPN Denial-of-Service Vulnerability,2022-03-03,2022-03-17,https://nvd.nist.gov/vuln/detail/CVE-2018-0154
CVE-2018-0151,Cisco,IOS and IOS XE Software,Cisco IOS Software and Cisco IOS XE Software Quality of Service Remote Code Execution Vulnerability,2022-03-03,2022-03-17,https://nvd.nist.gov/vuln/detail/CVE-2018-0151
CVE-2017-8540,Microsoft,Malware Protection Engine,Microsoft Malware Protection Engine Improper Restriction of Operations Vulnerability,2022-03-03,2022-03-24,https://nvd.nist.gov/vuln/detail/CVE-2017-8540
CVE-2017-6744,Cisco,IOS software,Cisco IOS Software SNMP Remote Code Execution Vulnerability,2022-03-03,2022-03-24,https://nvd.nist.gov/vuln/detail/CVE-2017-6744
CVE-2017-6743,Cisco,IOS and IOS XE Software,Cisco IOS and IOS XE Software SNMP Remote Code Execution Vulnerability,2022-03-03,2022-03-24,https://nvd.nist.gov/vuln/detail/CVE-2017-6743
CVE-2017-6740,Cisco,IOS and IOS XE Software,Cisco IOS and IOS XE Software SNMP Remote Code Execution Vulnerability,2022-03-03,2022-03-24,https://nvd.nist.gov/vuln/detail/CVE-2017-6740
CVE-2017-6739,Cisco,IOS and IOS XE Software,Cisco IOS and IOS XE Software SNMP Remote Code Execution Vulnerability,2022-03-03,2022-03-24,https://nvd.nist.gov/vuln/detail/CVE-2017-6739
CVE-2017-6738,Cisco,IOS and IOS XE Software,Cisco IOS and IOS XE Software SNMP Remote Code Execution Vulnerability,2022-03-03,2022-03-24,https://nvd.nist.gov/vuln/detail/CVE-2017-6738
CVE-2017-6737,Cisco,IOS and IOS XE Software,Cisco IOS and IOS XE Software SNMP Remote Code Execution Vulnerability,2022-03-03,2022-03-24,https://nvd.nist.gov/vuln/detail/CVE-2017-6737
CVE-2017-6736,Cisco,IOS and IOS XE Software,Cisco IOS and IOS XE Software SNMP Remote Code Execution Vulnerability,2022-03-03,2022-03-24,https://nvd.nist.gov/vuln/detail/CVE-2017-6736
CVE-2017-6663,Cisco,IOS and IOS XE Software,Cisco IOS Software and Cisco IOS XE Software Denial-of-Service Vulnerability,2022-03-03,2022-03-24,https://nvd.nist.gov/vuln/detail/CVE-2017-6663
CVE-2017-6627,Cisco,IOS and IOS XE Software,Cisco IOS Software and Cisco IOS XE Software UDP Packet Processing Denial-of-Service Vulnerability,2022-03-03,2022-03-24,https://nvd.nist.gov/vuln/detail/CVE-2017-6627
CVE-2017-12319,Cisco,IOS XE Software,Cisco IOS XE Software Ethernet Virtual Private Network Border Gateway Protocol Denial-of-Service Vulnerability,2022-03-03,2022-03-24,https://nvd.nist.gov/vuln/detail/CVE-2017-12319
CVE-2017-12240,Cisco,IOS and IOS XE Software,Cisco IOS and IOS XE Software DHCP Remote Code Execution Vulnerability,2022-03-03,2022-03-24,https://nvd.nist.gov/vuln/detail/CVE-2017-12240
CVE-2017-12238,Cisco,Catalyst 6800 Series Switches,Cisco Catalyst 6800 Series Switches VPLS Denial-of-Service Vulnerability,2022-03-03,2022-03-24,https://nvd.nist.gov/vuln/detail/CVE-2017-12238
CVE-2017-12237,Cisco,IOS and IOS XE Software,Cisco IOS and IOS XE Software Internet Key Exchange Denial-of-Service Vulnerability,2022-03-03,2022-03-24,https://nvd.nist.gov/vuln/detail/CVE-2017-12237
CVE-2017-12235,Cisco,IOS software,Cisco IOS Software for Cisco Industrial Ethernet Switches PROFINET Denial-of-Service Vulnerability,2022-03-03,2022-03-24,https://nvd.nist.gov/vuln/detail/CVE-2017-12235
CVE-2017-12234,Cisco,IOS software,Cisco IOS Software Common Industrial Protocol Request Denial-of-Service Vulnerability,2022-03-03,2022-03-24,https://nvd.nist.gov/vuln/detail/CVE-2017-12234
CVE-2017-12233,Cisco,IOS software,Cisco IOS Software Common Industrial Protocol Request Denial-of-Service Vulnerability,2022-03-03,2022-03-24,https://nvd.nist.gov/vuln/detail/CVE-2017-12233
CVE-2017-12232,Cisco,IOS software,Cisco IOS Software for Cisco Integrated Services Routers Denial-of-Service Vulnerability,2022-03-03,2022-03-24,https://nvd.nist.gov/vuln/detail/CVE-2017-12232
CVE-2017-12231,Cisco,IOS software,Cisco IOS Software Network Address Translation Denial-of-Service Vulnerability,2022-03-03,2022-03-24,https://nvd.nist.gov/vuln/detail/CVE-2017-12231
CVE-2017-11826,Microsoft,Office,Microsoft Office Remote Code Execution Vulnerability,2022-03-03,2022-03-24,https://nvd.nist.gov/vuln/detail/CVE-2017-11826
CVE-2017-11292,Adobe,Flash Player,Adobe Flash Player Type Confusion Vulnerability,2022-03-03,2022-03-24,https://nvd.nist.gov/vuln/detail/CVE-2017-11292
CVE-2017-0261,Microsoft,Office,Microsoft Office Use-After-Free Vulnerability,2022-03-03,2022-03-24,https://nvd.nist.gov/vuln/detail/CVE-2017-0261
CVE-2017-0001,Microsoft,Graphics Device Interface (GDI),Microsoft Graphics Device Interface (GDI) Privilege Escalation Vulnerability,2022-03-03,2022-03-24,https://nvd.nist.gov/vuln/detail/CVE-2017-0001
CVE-2016-8562,Siemens,SIMATIC CP,Siemens SIMATIC CP 1543-1 Improper Privilege Management Vulnerability,2022-03-03,2022-03-24,https://nvd.nist.gov/vuln/detail/CVE-2016-8562
CVE-2016-7855,Adobe,Flash Player,Adobe Flash Player Use-After-Free Vulnerability,2022-03-03,2022-03-24,https://nvd.nist.gov/vuln/detail/CVE-2016-7855
CVE-2016-7262,Microsoft,Excel,Microsoft Office Security Feature Bypass Vulnerability,2022-03-03,2022-03-24,https://nvd.nist.gov/vuln/detail/CVE-2016-7262
CVE-2016-7193,Microsoft,Office,Microsoft Office Memory Corruption Vulnerability,2022-03-03,2022-03-24,https://nvd.nist.gov/vuln/detail/CVE-2016-7193
CVE-2016-5195,Linux,Kernel,Linux Kernel Race Condition Vulnerability,2022-03-03,2022-03-24,https://nvd.nist.gov/vuln/detail/CVE-2016-5195
CVE-2016-4117,Adobe,Flash Player,Adobe Flash Player Arbitrary Code Execution Vulnerability,2022-03-03,2022-03-24,https://nvd.nist.gov/vuln/detail/CVE-2016-4117
CVE-2016-1019,Adobe,Flash Player,Adobe Flash Player Arbitrary Code Execution Vulnerability,2022-03-03,2022-03-24,https://nvd.nist.gov/vuln/detail/CVE-2016-1019
CVE-2016-0099,Microsoft,Windows,Microsoft Windows Secondary Logon Service Privilege Escalation Vulnerability,2022-03-03,2022-03-24,https://nvd.nist.gov/vuln/detail/CVE-2016-0099
CVE-2015-7645,Adobe,Flash Player,Adobe Flash Player Arbitrary Code Execution Vulnerability,2022-03-03,2022-03-24,https://nvd.nist.gov/vuln/detail/CVE-2015-7645
