cve_id,vendor,product,vuln_name,dateAdded,dueDate,notes
CVE-2018-19322,GIGABYTE,Multiple Products,GIGABYTE Multiple Products Code Execution Vulnerability,2022-10-24,2022-11-14,https://www.gigabyte.com/Support/Security/1801; https://nvd.nist.gov/vuln/detail/CVE-2018-19322
CVE-2018-19321,GIGABYTE,Multiple Products,GIGABYTE Multiple Products Privilege Escalation Vulnerability,2022-10-24,2022-11-14,https://www.gigabyte.com/Support/Security/1801; https://nvd.nist.gov/vuln/detail/CVE-2018-19321
CVE-2018-19320,GIGABYTE,Multiple Products,GIGABYTE Multiple Products Unspecified Vulnerability,2022-10-24,2022-11-14,https://www.gigabyte.com/Support/Security/1801; https://nvd.nist.gov/vuln/detail/CVE-2018-19320
CVE-2022-41352,Synacor,Zimbra Collaboration Suite (ZCS),Synacor Zimbra Collaboration Suite (ZCS) Arbitrary File Upload Vulnerability,2022-10-20,2022-11-10,https://wiki.zimbra.com/wiki/Security_Center;  https://nvd.nist.gov/vuln/detail/CVE-2022-41352
CVE-2021-3493,Linux,Kernel,Linux Kernel Privilege Escalation Vulnerability,2022-10-20,2022-11-10,https://git.kernel.org/pub/scm/linux/kernel/git/torvalds/linux.git/commit/?id=7c03e2cda4a584cadc398e8f6641ca9988a39d52; https://nvd.nist.gov/vuln/detail/CVE-2021-3493
CVE-2022-40684,Fortinet,Multiple Products,Fortinet Multiple Products Authentication Bypass Vulnerability,2022-10-11,2022-11-01,https://www.fortiguard.com/psirt/FG-IR-22-377;  https://nvd.nist.gov/vuln/detail/CVE-2022-40684
CVE-2022-41033,Microsoft,Windows COM+ Event System Service,Microsoft Windows COM+ Event System Service Privilege Escalation Vulnerability,2022-10-11,2022-11-01,https://msrc.microsoft.com/update-guide/en-US/vulnerability/CVE-2022-41033;  https://nvd.nist.gov/vuln/detail/CVE-2022-41033
CVE-2022-41082,Microsoft,Exchange Server,Microsoft Exchange Server Remote Code Execution Vulnerability,2022-09-30,2022-10-21,https://msrc-blog.microsoft.com/2022/09/29/customer-guidance-for-reported-zero-day-vulnerabilities-in-microsoft-exchange-server/;  https://nvd.nist.gov/vuln/detail/CVE-2022-41082
CVE-2022-41040,Microsoft,Exchange Server,Microsoft Exchange Server Server-Side Request Forgery Vulnerability,2022-09-30,2022-10-21,https://msrc-blog.microsoft.com/2022/09/29/customer-guidance-for-reported-zero-day-vulnerabilities-in-microsoft-exchange-server/;  https://nvd.nist.gov/vuln/detail/CVE-2022-41040
CVE-2022-36804,Atlassian,Bitbucket Server and Data Center,Atlassian Bitbucket Server and Data Center Command Injection Vulnerability,2022-09-30,2022-10-21,https://jira.atlassian.com/browse/BSERV-13438;  https://nvd.nist.gov/vuln/detail/CVE-2022-36804
CVE-2022-3236,Sophos,Firewall,Sophos Firewall Code Injection Vulnerability,2022-09-23,2022-10-14,https://www.sophos.com/en-us/security-advisories/sophos-sa-20220923-sfos-rce;  https://nvd.nist.gov/vuln/detail/CVE-2022-3236
CVE-2022-35405,Zoho,ManageEngine,Zoho ManageEngine Multiple Products Remote Code Execution Vulnerability,2022-09-22,2022-10-13,https://www.manageengine.com/products/passwordmanagerpro/advisory/cve-2022-35405.html;  https://nvd.nist.gov/vuln/detail/CVE-2022-35405
CVE-2022-40139,Trend Micro,Apex One and Apex One as a Service,Trend Micro Apex One and Apex One as a Service Improper Validation Vulnerability,2022-09-15,2022-10-06,https://success.trendmicro.com/dcx/s/solution/000291528?language=en_US;  https://nvd.nist.gov/vuln/detail/CVE-2022-40139
CVE-2013-6282,Linux,Kernel,Linux Kernel Improper Input Validation Vulnerability,2022-09-15,2022-10-06,https://git.kernel.org/pub/scm/linux/kernel/git/torvalds/linux.git/commit/?id=8404663f81d212918ff85f493649a7991209fa04; https://nvd.nist.gov/vuln/detail/CVE-2013-6282
CVE-2013-2597,Code Aurora,ACDB Audio Driver,Code Aurora ACDB Audio Driver Stack-based Buffer Overflow Vulnerability,2022-09-15,2022-10-06,https://web.archive.org/web/20161226013354/https:/www.codeaurora.org/news/security-advisories/stack-based-buffer-overflow-acdb-audio-driver-cve-2013-2597; https://nvd.nist.gov/vuln/detail/CVE-2013-2597
CVE-2013-2596,Linux,Kernel,Linux Kernel Integer Overflow Vulnerability,2022-09-15,2022-10-06,https://git.kernel.org/pub/scm/linux/kernel/git/torvalds/linux.git/commit/?id=fc9bbca8f650e5f738af8806317c0a041a48ae4a; https://nvd.nist.gov/vuln/detail/CVE-2013-2596
CVE-2013-2094,Linux,Kernel,Linux Kernel Privilege Escalation Vulnerability,2022-09-15,2022-10-06,https://git.kernel.org/pub/scm/linux/kernel/git/torvalds/linux.git/commit/?id=8176cced706b5e5d15887584150764894e94e02f; https://nvd.nist.gov/vuln/detail/CVE-2013-2094
CVE-2010-2568,Microsoft,Windows,Microsoft Windows Remote Code Execution Vulnerability,2022-09-15,2022-10-06,https://docs.microsoft.com/en-us/security-updates/securitybulletins/2010/ms10-046; https://nvd.nist.gov/vuln/detail/CVE-2010-2568
CVE-2022-37969,Microsoft,Windows,Microsoft Windows Common Log File System (CLFS) Driver Privilege Escalation Vulnerability,2022-09-14,2022-10-05,https://msrc.microsoft.com/update-guide/en-US/vulnerability/CVE-2022-37969;  https://nvd.nist.gov/vuln/detail/CVE-2022-37969
CVE-2022-32917,Apple,"iOS, iPadOS, and macOS","Apple iOS, iPadOS, and macOS Remote Code Execution Vulnerability",2022-09-14,2022-10-05,"https://support.apple.com/en-us/HT213445, https://support.apple.com/en-us/HT213444;  https://nvd.nist.gov/vuln/detail/CVE-2022-32917"
CVE-2022-3075,Google,Chromium Mojo,Google Chromium Mojo Insufficient Data Validation Vulnerability,2022-09-08,2022-09-29,"https://chromereleases.googleblog.com/2022/09/stable-channel-update-for-desktop.html, https://msrc.microsoft.com/update-guide/vulnerability/CVE-2022-3075;  https://nvd.nist.gov/vuln/detail/CVE-2022-3075"
CVE-2022-27593,QNAP,Photo Station,QNAP Photo Station Externally Controlled Reference Vulnerability,2022-09-08,2022-09-29,https://www.qnap.com/en/security-advisory/qsa-22-24;  https://nvd.nist.gov/vuln/detail/CVE-2022-27593
CVE-2022-26258,D-Link,DIR-820L,D-Link DIR-820L Remote Code Execution Vulnerability,2022-09-08,2022-09-29,https://supportannouncement.us.dlink.com/announcement/publication.aspx?name=SAP10295;  https://nvd.nist.gov/vuln/detail/CVE-2022-26258
CVE-2020-9934,Apple,"iOS, iPadOS, and macOS","Apple iOS, iPadOS, and macOS Input Validation Vulnerability",2022-09-08,2022-09-29,"https://support.apple.com/en-us/HT211288, https://support.apple.com/en-us/HT211289; https://nvd.nist.gov/vuln/detail/CVE-2020-9934"
CVE-2018-7445,MikroTik,RouterOS,MikroTik RouterOS Stack-Based Buffer Overflow Vulnerability,2022-09-08,2022-09-29,"https://www.coresecurity.com/core-labs/advisories/mikrotik-routeros-smb-buffer-overflow#vendor_update, https://mikrotik.com/download; https://nvd.nist.gov/vuln/detail/CVE-2018-7445"
CVE-2018-6530,D-Link,Multiple Routers,D-Link Multiple Routers OS Command Injection Vulnerability,2022-09-08,2022-09-29,https://supportannouncement.us.dlink.com/announcement/publication.aspx?name=SAP10105; https://nvd.nist.gov/vuln/detail/CVE-2018-6530
CVE-2018-2628,Oracle,WebLogic Server,Oracle WebLogic Server Unspecified Vulnerability,2022-09-08,2022-09-29,https://www.oracle.com/security-alerts/cpuapr2018.html; https://nvd.nist.gov/vuln/detail/CVE-2018-2628
CVE-2018-13374,Fortinet,FortiOS and FortiADC,Fortinet FortiOS and FortiADC Improper Access Control Vulnerability,2022-09-08,2022-09-29,https://www.fortiguard.com/psirt/FG-IR-18-157; https://nvd.nist.gov/vuln/detail/CVE-2018-13374
CVE-2017-5521,NETGEAR,Multiple Devices,NETGEAR Multiple Devices Exposure of Sensitive Information Vulnerability,2022-09-08,2022-09-29,https://kb.netgear.com/30632/Web-GUI-Password-Recovery-and-Exposure-Security-Vulnerability; https://nvd.nist.gov/vuln/detail/CVE-2017-5521
CVE-2011-4723,D-Link,DIR-300 Router,D-Link DIR-300 Router Cleartext Storage of a Password Vulnerability,2022-09-08,2022-09-29,https://www.dlink.com/uk/en/support/product/dir-300-wireless-g-router; https://nvd.nist.gov/vuln/detail/CVE-2011-4723
CVE-2011-1823,Android,Android OS,Android OS Privilege Escalation Vulnerability,2022-09-08,2022-09-29,https://android.googlesource.com/platform/system/vold/+/c51920c82463b240e2be0430849837d6fdc5352e; https://nvd.nist.gov/vuln/detail/CVE-2011-1823
CVE-2022-26352,dotCMS,dotCMS,dotCMS Unrestricted Upload of File Vulnerability,2022-08-25,2022-09-15,https://www.dotcms.com/security/SI-62;  https://nvd.nist.gov/vuln/detail/CVE-2022-26352
CVE-2022-24706,Apache,CouchDB,Apache CouchDB Insecure Default Initialization of Resource Vulnerability,2022-08-25,2022-09-15,https://lists.apache.org/thread/w24wo0h8nlctfps65txvk0oc5hdcnv00;  https://nvd.nist.gov/vuln/detail/CVE-2022-24706
CVE-2022-24112,Apache,APISIX,Apache APISIX Authentication Bypass Vulnerability,2022-08-25,2022-09-15,https://lists.apache.org/thread/lcdqywz8zy94mdysk7p3gfdgn51jmt94;  https://nvd.nist.gov/vuln/detail/CVE-2022-24112
CVE-2022-22963,VMware Tanzu,Spring Cloud,VMware Tanzu Spring Cloud Function Remote Code Execution Vulnerability,2022-08-25,2022-09-15,https://tanzu.vmware.com/security/cve-2022-22963;  https://nvd.nist.gov/vuln/detail/CVE-2022-22963
CVE-2022-2294,WebRTC,WebRTC,WebRTC Heap Buffer Overflow Vulnerability,2022-08-25,2022-09-15,https://groups.google.com/g/discuss-webrtc/c/5KBtZx2gvcQ;  https://nvd.nist.gov/vuln/detail/CVE-2022-2294
CVE-2021-39226,Grafana Labs,Grafana,Grafana Authentication Bypass Vulnerability,2022-08-25,2022-09-15,https://grafana.com/blog/2021/10/05/grafana-7.5.11-and-8.1.6-released-with-critical-security-fix/; https://nvd.nist.gov/vuln/detail/CVE-2021-39226
CVE-2021-38406,Delta Electronics,DOPSoft 2,Delta Electronics DOPSoft 2 Improper Input Validation Vulnerability,2022-08-25,2022-09-15,https://www.cisa.gov/uscert/ics/advisories/icsa-21-252-02; https://nvd.nist.gov/vuln/detail/CVE-2021-38406
CVE-2021-31010,Apple,"iOS, macOS, watchOS","Apple iOS, macOS, watchOS Sandbox Bypass Vulnerability",2022-08-25,2022-09-15,"https://support.apple.com/en-us/HT212804, https://support.apple.com/en-us/HT212805, https://support.apple.com/en-us/HT212806, https://support.apple.com/en-us/HT212807, https://support.apple.com/en-us/HT212824; https://nvd.nist.gov/vuln/detail/CVE-2021-31010"
CVE-2020-36193,PEAR,Archive_Tar,PEAR Archive_Tar Improper Link Resolution Vulnerability,2022-08-25,2022-09-15,"https://github.com/pear/Archive_Tar/commit/cde460582ff389404b5b3ccb59374e9b389de916, https://www.drupal.org/sa-core-2021-001, https://access.redhat.com/security/cve/cve-2020-36193; https://nvd.nist.gov/vuln/detail/CVE-2020-36193"
CVE-2020-28949,PEAR,Archive_Tar,PEAR Archive_Tar Deserialization of Untrusted Data Vulnerability,2022-08-25,2022-09-15,"https://pear.php.net/bugs/bug.php?id=27002, https://www.drupal.org/sa-core-2020-013, https://access.redhat.com/security/cve/cve-2020-28949; https://nvd.nist.gov/vuln/detail/CVE-2020-28949"
CVE-2022-0028,Palo Alto Networks,PAN-OS,Palo Alto Networks PAN-OS Reflected Amplification Denial-of-Service Vulnerability,2022-08-22,2022-09-12,https://security.paloaltonetworks.com/CVE-2022-0028; https://nvd.nist.gov/vuln/detail/CVE-2022-0028
CVE-2022-22536,SAP,Multiple Products,SAP Multiple Products HTTP Request Smuggling Vulnerability,2022-08-18,2022-09-08,SAP users must have an account in order to login and access the patch. https://accounts.sap.com/saml2/idp/sso;  https://nvd.nist.gov/vuln/detail/CVE-2022-22536
CVE-2022-32894,Apple,iOS and macOS,Apple iOS and macOS Out-of-Bounds Write Vulnerability,2022-08-18,2022-09-08,"https://support.apple.com/en-gb/HT213412, https://support.apple.com/en-gb/HT213413;  https://nvd.nist.gov/vuln/detail/CVE-2022-32894"
CVE-2022-32893,Apple,iOS and macOS,Apple iOS and macOS Out-of-Bounds Write Vulnerability,2022-08-18,2022-09-08,"https://support.apple.com/en-gb/HT213412, https://support.apple.com/en-gb/HT213413;  https://nvd.nist.gov/vuln/detail/CVE-2022-32893"
CVE-2022-2856,Google,Chromium Intents,Google Chromium Intents Insufficient Input Validation Vulnerability,2022-08-18,2022-09-08,https://chromereleases.googleblog.com/2022/08/stable-channel-update-for-desktop_16.html;  https://nvd.nist.gov/vuln/detail/CVE-2022-2856
CVE-2022-26923,Microsoft,Active Directory,Microsoft Active Directory Domain Services Privilege Escalation Vulnerability,2022-08-18,2022-09-08,https://msrc.microsoft.com/update-guide/en-US/vulnerability/CVE-2022-26923;  https://nvd.nist.gov/vuln/detail/CVE-2022-26923
CVE-2022-21971,Microsoft,Windows,Microsoft Windows Runtime Remote Code Execution Vulnerability,2022-08-18,2022-09-08,https://msrc.microsoft.com/update-guide/vulnerability/CVE-2022-21971;  https://nvd.nist.gov/vuln/detail/CVE-2022-21971
CVE-2017-15944,Palo Alto Networks,PAN-OS,Palo Alto Networks PAN-OS Remote Code Execution Vulnerability,2022-08-18,2022-09-08,https://security.paloaltonetworks.com/CVE-2017-15944; https://nvd.nist.gov/vuln/detail/CVE-2017-15944
CVE-2022-27925,Synacor,Zimbra Collaboration Suite (ZCS),Synacor Zimbra Collaboration Suite (ZCS) Arbitrary File Upload Vulnerability,2022-08-11,2022-09-01,https://blog.zimbra.com/2022/08/authentication-bypass-in-mailboximportservlet-vulnerability/;  https://nvd.nist.gov/vuln/detail/CVE-2022-27925
CVE-2022-37042,Synacor,Zimbra Collaboration Suite (ZCS),Synacor Zimbra Collaboration Suite (ZCS) Authentication Bypass Vulnerability,2022-08-11,2022-09-01,https://blog.zimbra.com/2022/08/authentication-bypass-in-mailboximportservlet-vulnerability/;  https://nvd.nist.gov/vuln/detail/CVE-2022-37042
CVE-2022-34713,Microsoft,Windows,Microsoft Windows Support Diagnostic Tool (MSDT) Remote Code Execution Vulnerability,2022-08-09,2022-08-30,https://msrc.microsoft.com/update-guide/vulnerability/CVE-2022-34713;  https://nvd.nist.gov/vuln/detail/CVE-2022-34713
CVE-2022-30333,RARLAB,UnRAR,RARLAB UnRAR Directory Traversal Vulnerability,2022-08-09,2022-08-30,Vulnerability updated with version 6.12. Accessing link will download update information: https://www.rarlab.com/rar/rarlinux-x32-612.tar.gz;  https://nvd.nist.gov/vuln/detail/CVE-2022-30333
CVE-2022-27924,Synacor,Zimbra Collaboration Suite (ZCS),Synacor Zimbra Collaboration Suite (ZCS) Command Injection Vulnerability,2022-08-04,2022-08-25,https://wiki.zimbra.com/wiki/Zimbra_Releases/9.0.0/P24.1#Security_Fixes;  https://nvd.nist.gov/vuln/detail/CVE-2022-27924
CVE-2022-26138,Atlassian,Confluence,Atlassian Questions For Confluence App Hard-coded Credentials Vulnerability,2022-07-29,2022-08-19,https://confluence.atlassian.com/doc/questions-for-confluence-security-advisory-2022-07-20-1142446709.html;  https://nvd.nist.gov/vuln/detail/CVE-2022-26138
CVE-2022-22047,Microsoft,Windows,Microsoft Windows Client Server Runtime Subsystem (CSRSS) Privilege Escalation Vulnerability,2022-07-12,2022-08-02,https://msrc.microsoft.com/update-guide/vulnerability/CVE-2022-22047;  https://nvd.nist.gov/vuln/detail/CVE-2022-22047
CVE-2022-26925,Microsoft,Windows,Microsoft Windows LSA Spoofing Vulnerability,2022-07-01,2022-07-22,WARNING: This update is required on all Microsoft Windows endpoints but if deployed to domain controllers without additional configuration changes the update breaks PIV/CAC authentication. Read CISA implementation guidance carefully before deploying to domain controllers.;  https://nvd.nist.gov/vuln/detail/CVE-2022-26925
CVE-2022-29499,Mitel,MiVoice Connect,Mitel MiVoice Connect Data Validation Vulnerability,2022-06-27,2022-07-18,https://nvd.nist.gov/vuln/detail/CVE-2022-29499
CVE-2021-30533,Google,Chromium PopupBlocker,Google Chromium PopupBlocker Security Bypass Vulnerability,2022-06-27,2022-07-18,https://nvd.nist.gov/vuln/detail/CVE-2021-30533
CVE-2021-4034,Red Hat,Polkit,Red Hat Polkit Out-of-Bounds Read and Write Vulnerability,2022-06-27,2022-07-18,https://nvd.nist.gov/vuln/detail/CVE-2021-4034
CVE-2021-30983,Apple,iOS and iPadOS,Apple iOS and iPadOS Buffer Overflow Vulnerability,2022-06-27,2022-07-18,https://nvd.nist.gov/vuln/detail/CVE-2021-30983
CVE-2020-3837,Apple,Multiple Products,Apple Multiple Products Memory Corruption Vulnerability,2022-06-27,2022-07-18,https://nvd.nist.gov/vuln/detail/CVE-2020-3837
CVE-2020-9907,Apple,Multiple Products,Apple Multiple Products Memory Corruption Vulnerability,2022-06-27,2022-07-18,https://nvd.nist.gov/vuln/detail/CVE-2020-9907
CVE-2019-8605,Apple,Multiple Products,Apple Multiple Products Use-After-Free Vulnerability,2022-06-27,2022-07-18,https://nvd.nist.gov/vuln/detail/CVE-2019-8605
CVE-2018-4344,Apple,Multiple Products,Apple Multiple Products Memory Corruption Vulnerability,2022-06-27,2022-07-18,https://nvd.nist.gov/vuln/detail/CVE-2018-4344
CVE-2022-30190,Microsoft,Windows,Microsoft Windows Support Diagnostic Tool (MSDT) Remote Code Execution Vulnerability,2022-06-14,2022-07-05,https://nvd.nist.gov/vuln/detail/CVE-2022-30190
CVE-2021-38163,SAP,NetWeaver,SAP NetWeaver Unrestricted File Upload Vulnerability,2022-06-09,2022-06-30,https://nvd.nist.gov/vuln/detail/CVE-2021-38163
CVE-2016-2386,SAP,NetWeaver,SAP NetWeaver SQL Injection Vulnerability,2022-06-09,2022-06-30,https://nvd.nist.gov/vuln/detail/CVE-2016-2386
CVE-2016-2388,SAP,NetWeaver,SAP NetWeaver Information Disclosure Vulnerability,2022-06-09,2022-06-30,https://nvd.nist.gov/vuln/detail/CVE-2016-2388
CVE-2019-7195,QNAP,Photo Station,QNAP Photo Station Path Traversal Vulnerability,2022-06-08,2022-06-22,https://nvd.nist.gov/vuln/detail/CVE-2019-7195
CVE-2019-7194,QNAP,Photo Station,QNAP Photo Station Path Traversal Vulnerability,2022-06-08,2022-06-22,https://nvd.nist.gov/vuln/detail/CVE-2019-7194
CVE-2019-7193,QNAP,QTS,QNAP QTS Improper Input Validation Vulnerability,2022-06-08,2022-06-22,https://nvd.nist.gov/vuln/detail/CVE-2019-7193
CVE-2019-7192,QNAP,Photo Station,QNAP Photo Station Improper Access Control Vulnerability,2022-06-08,2022-06-22,https://nvd.nist.gov/vuln/detail/CVE-2019-7192
CVE-2019-5825,Google,Chromium V8,Google Chromium V8 Out-of-Bounds Write Vulnerability,2022-06-08,2022-06-22,https://nvd.nist.gov/vuln/detail/CVE-2019-5825
CVE-2019-15271,Cisco,RV Series Routers,Cisco RV Series Routers Deserialization of Untrusted Data Vulnerability,2022-06-08,2022-06-22,https://nvd.nist.gov/vuln/detail/CVE-2019-15271
CVE-2018-6065,Google,Chromium V8,Google Chromium V8 Integer Overflow Vulnerability,2022-06-08,2022-06-22,https://nvd.nist.gov/vuln/detail/CVE-2018-6065
CVE-2018-4990,Adobe,Acrobat and Reader,Adobe Acrobat and Reader Double Free Vulnerability,2022-06-08,2022-06-22,https://nvd.nist.gov/vuln/detail/CVE-2018-4990
CVE-2018-17480,Google,Chromium V8,Google Chromium V8 Out-of-Bounds Write Vulnerability,2022-06-08,2022-06-22,https://nvd.nist.gov/vuln/detail/CVE-2018-17480
CVE-2018-17463,Google,Chromium V8,Google Chromium V8 Remote Code Execution Vulnerability,2022-06-08,2022-06-22,https://nvd.nist.gov/vuln/detail/CVE-2018-17463
CVE-2017-6862,NETGEAR,Multiple Devices,NETGEAR Multiple Devices Buffer Overflow Vulnerability,2022-06-08,2022-06-22,https://nvd.nist.gov/vuln/detail/CVE-2017-6862
CVE-2017-5070,Google,Chromium V8,Google Chromium V8 Type Confusion Vulnerability,2022-06-08,2022-06-22,https://nvd.nist.gov/vuln/detail/CVE-2017-5070
CVE-2017-5030,Google,Chromium V8,Google Chromium V8 Memory Corruption Vulnerability,2022-06-08,2022-06-22,https://nvd.nist.gov/vuln/detail/CVE-2017-5030
CVE-2016-5198,Google,Chromium V8,Google Chromium V8 Out-of-Bounds Memory Vulnerability,2022-06-08,2022-06-22,https://nvd.nist.gov/vuln/detail/CVE-2016-5198
CVE-2016-1646,Google,Chromium V8,Google Chromium V8 Out-of-Bounds Read Vulnerability,2022-06-08,2022-06-22,https://nvd.nist.gov/vuln/detail/CVE-2016-1646
CVE-2013-1331,Microsoft,Office,Microsoft Office Buffer Overflow Vulnerability,2022-06-08,2022-06-22,https://nvd.nist.gov/vuln/detail/CVE-2013-1331
CVE-2012-5054,Adobe,Flash Player,Adobe Flash Player Integer Overflow Vulnerability,2022-06-08,2022-06-22,https://nvd.nist.gov/vuln/detail/CVE-2012-5054
CVE-2012-4969,Microsoft,Internet Explorer,Microsoft Internet Explorer Use-After-Free Vulnerability,2022-06-08,2022-06-22,https://nvd.nist.gov/vuln/detail/CVE-2012-4969
CVE-2012-1889,Microsoft,XML Core Services,Microsoft XML Core Services Memory Corruption Vulnerability,2022-06-08,2022-06-22,https://nvd.nist.gov/vuln/detail/CVE-2012-1889
CVE-2012-0767,Adobe,Flash Player,Adobe Flash Player Cross-Site Scripting (XSS) Vulnerability,2022-06-08,2022-06-22,https://nvd.nist.gov/vuln/detail/CVE-2012-0767
CVE-2012-0754,Adobe,Flash Player,Adobe Flash Player Memory Corruption Vulnerability,2022-06-08,2022-06-22,https://nvd.nist.gov/vuln/detail/CVE-2012-0754
CVE-2012-0151,Microsoft,Windows,Microsoft Windows Authenticode Signature Verification Remote Code Execution Vulnerability,2022-06-08,2022-06-22,https://nvd.nist.gov/vuln/detail/CVE-2012-0151
CVE-2011-2462,Adobe,Acrobat and Reader,Adobe Acrobat and Reader Universal 3D Memory Corruption Vulnerability,2022-06-08,2022-06-22,https://nvd.nist.gov/vuln/detail/CVE-2011-2462
CVE-2011-0609,Adobe,Flash Player,Adobe Flash Player Unspecified Vulnerability,2022-06-08,2022-06-22,https://nvd.nist.gov/vuln/detail/CVE-2011-0609
CVE-2010-2883,Adobe,Acrobat and Reader,Adobe Acrobat and Reader Stack-Based Buffer Overflow Vulnerability,2022-06-08,2022-06-22,https://nvd.nist.gov/vuln/detail/CVE-2010-2883
CVE-2010-2572,Microsoft,PowerPoint,Microsoft PowerPoint Buffer Overflow Vulnerability,2022-06-08,2022-06-22,https://nvd.nist.gov/vuln/detail/CVE-2010-2572
CVE-2010-1297,Adobe,Flash Player,Adobe Flash Player Memory Corruption Vulnerability,2022-06-08,2022-06-22,https://nvd.nist.gov/vuln/detail/CVE-2010-1297
CVE-2009-4324,Adobe,Acrobat and Reader,Adobe Acrobat and Reader Use-After-Free Vulnerability,2022-06-08,2022-06-22,https://nvd.nist.gov/vuln/detail/CVE-2009-4324
CVE-2009-3953,Adobe,Acrobat and Reader,Adobe Acrobat and Reader Universal 3D Remote Code Execution Vulnerability,2022-06-08,2022-06-22,https://nvd.nist.gov/vuln/detail/CVE-2009-3953
CVE-2009-1862,Adobe,"Acrobat and Reader, Flash Player","Adobe Acrobat and Reader, Flash Player Unspecified Vulnerability",2022-06-08,2022-06-22,https://nvd.nist.gov/vuln/detail/CVE-2009-1862
CVE-2009-0563,Microsoft,Office,Microsoft Office Buffer Overflow Vulnerability,2022-06-08,2022-06-22,https://nvd.nist.gov/vuln/detail/CVE-2009-0563
CVE-2009-0557,Microsoft,Office,Microsoft Office Object Record Corruption Vulnerability,2022-06-08,2022-06-22,https://nvd.nist.gov/vuln/detail/CVE-2009-0557
CVE-2008-0655,Adobe,Acrobat and Reader,Adobe Acrobat and Reader Unspecified Vulnerability,2022-06-08,2022-06-22,https://nvd.nist.gov/vuln/detail/CVE-2008-0655
CVE-2007-5659,Adobe,Acrobat and Reader,Adobe Acrobat and Reader Buffer Overflow Vulnerability,2022-06-08,2022-06-22,https://nvd.nist.gov/vuln/detail/CVE-2007-5659
CVE-2006-2492,Microsoft,Word,Microsoft Word Malformed Object Pointer Vulnerability,2022-06-08,2022-06-22,https://nvd.nist.gov/vuln/detail/CVE-2006-2492
CVE-2022-26134,Atlassian,Confluence Server/Data Center,Atlassian Confluence Server and Data Center Remote Code Execution Vulnerability,2022-06-02,2022-06-06,https://nvd.nist.gov/vuln/detail/CVE-2022-26134
CVE-2019-3010,Oracle,Solaris,Oracle Solaris Privilege Escalation Vulnerability,2022-05-25,2022-06-15,https://nvd.nist.gov/vuln/detail/CVE-2019-3010
CVE-2016-3393,Microsoft,Windows,Microsoft Windows Graphics Device Interface (GDI) Remote Code Execution Vulnerability,2022-05-25,2022-06-15,https://nvd.nist.gov/vuln/detail/CVE-2016-3393
CVE-2016-7256,Microsoft,Windows,Microsoft Windows Open Type Font Remote Code Execution Vulnerability,2022-05-25,2022-06-15,https://nvd.nist.gov/vuln/detail/CVE-2016-7256
CVE-2016-1010,Adobe,Flash Player and AIR,Adobe Flash Player and AIR Integer Overflow Vulnerability,2022-05-25,2022-06-15,https://nvd.nist.gov/vuln/detail/CVE-2016-1010
CVE-2016-0984,Adobe,Flash Player and AIR,Adobe Flash Player and AIR Use-After-Free Vulnerability,2022-05-25,2022-06-15,https://nvd.nist.gov/vuln/detail/CVE-2016-0984
CVE-2016-0034,Microsoft,Silverlight,Microsoft Silverlight Runtime Remote Code Execution Vulnerability,2022-05-25,2022-06-15,https://nvd.nist.gov/vuln/detail/CVE-2016-0034
CVE-2015-0310,Adobe,Flash Player,Adobe Flash Player ASLR Bypass Vulnerability,2022-05-25,2022-06-15,https://nvd.nist.gov/vuln/detail/CVE-2015-0310
CVE-2015-0016,Microsoft,Windows,Microsoft Windows TS WebProxy Directory Traversal Vulnerability,2022-05-25,2022-06-15,https://nvd.nist.gov/vuln/detail/CVE-2015-0016
CVE-2015-0071,Microsoft,Internet Explorer,Microsoft Internet Explorer ASLR Bypass Vulnerability,2022-05-25,2022-06-15,https://nvd.nist.gov/vuln/detail/CVE-2015-0071
CVE-2015-2360,Microsoft,Win32k,Microsoft Win32k Privilege Escalation Vulnerability,2022-05-25,2022-06-15,https://nvd.nist.gov/vuln/detail/CVE-2015-2360
CVE-2015-2425,Microsoft,Internet Explorer,Microsoft Internet Explorer Memory Corruption Vulnerability,2022-05-25,2022-06-15,https://nvd.nist.gov/vuln/detail/CVE-2015-2425
CVE-2015-1769,Microsoft,Windows,Microsoft Windows Mount Manager Privilege Escalation Vulnerability,2022-05-25,2022-06-15,https://nvd.nist.gov/vuln/detail/CVE-2015-1769
CVE-2015-4495,Mozilla,Firefox,Mozilla Firefox Security Feature Bypass Vulnerability,2022-05-25,2022-06-15,https://nvd.nist.gov/vuln/detail/CVE-2015-4495
CVE-2015-8651,Adobe,Flash Player,Adobe Flash Player Integer Overflow Vulnerability,2022-05-25,2022-06-15,https://nvd.nist.gov/vuln/detail/CVE-2015-8651
CVE-2015-6175,Microsoft,Windows,Microsoft Windows Kernel Privilege Escalation Vulnerability,2022-05-25,2022-06-15,https://nvd.nist.gov/vuln/detail/CVE-2015-6175
CVE-2015-1671,Microsoft,Windows,Microsoft Windows Remote Code Execution Vulnerability,2022-05-25,2022-06-15,https://nvd.nist.gov/vuln/detail/CVE-2015-1671
CVE-2014-4148,Microsoft,Windows,Microsoft Windows Remote Code Execution Vulnerability,2022-05-25,2022-06-15,https://nvd.nist.gov/vuln/detail/CVE-2014-4148
CVE-2014-8439,Adobe,Flash Player,Adobe Flash Player Dereferenced Pointer Vulnerability,2022-05-25,2022-06-15,https://nvd.nist.gov/vuln/detail/CVE-2014-8439
